<?xml version="1.0" encoding="UTF-8"?>
<formularz xmlns:xsi="http://www.w3.org/2001/XMLSchema-instance" xsi:noNamespaceSchemaLocation="xml.xsd">
    <dane_osobowe>
        <imie_i_nazwisko>Jan Kowalski</imie_i_nazwisko>
        <adres>Aleje Jerozolimskie 24/3</adres>
        <e-mail>jan.kowalski@person.org</e-mail>
        <telefon_komorkowy>123456789</telefon_komorkowy>
    </dane_osobowe>
    <zwracany_towar>
        <numer_dokumentu_zakupu>754373485822222222235</numer_dokumentu_zakupu>
        <nazwa_towaru>
            <nazwa>Laptop_Acer_14"_R5_5600+16+1024</nazwa>
            <ilosc>1</ilosc>
            <cena>3999</cena>
        </nazwa_towaru>
        <powody_zwrotu>nie dzia≈Ça</powody_zwrotu>
        <wartosc_zwracanego_towaru>3999</wartosc_zwracanego_towaru>
        <data_zakupu>2024-04-17</data_zakupu>
        <podpis>Jan Kowalski</podpis>
    </zwracany_towar>
    <dane_potrzebne_do_zwrotu_srodkow>
        <numer_rachunku_bankowego>8190008000700060005000</numer_rachunku_bankowego>
        <imie_i_nazwisko>Jan Kowalski</imie_i_nazwisko>
        <adres>Aleje Jerozolimskie 24/3</adres>
        <data>2024-04-20</data>
        <podpis>Jan Kowalski</podpis>    
    </dane_potrzebne_do_zwrotu_srodkow>
</formularz>